{
  "assetInventory": {
    ".a": 22,
    ".asmdef": 5,
    ".asset": 13,
    ".bank": 5,
    ".blend": 2,
    ".blend1": 1,
    ".br": 4,
    ".cs": 195,
    ".dll": 21,
    ".dylib": 1,
    ".exr": 4,
    ".fbx": 123,
    ".flac": 3,
    ".fobj": 330,
    ".fspro": 1,
    ".jar": 1,
    ".jpg": 2,
    ".js": 4,
    ".json": 159,
    ".mat": 91,
    ".md": 8,
    ".mid": 1,
    ".mm": 1,
    ".mp4": 1,
    ".otf": 24,
    ".plist": 13,
    ".png": 290,
    ".po": 2,
    ".py": 176,
    ".sh": 2,
    ".shader": 8,
    ".so": 25,
    ".svg": 21,
    ".swift": 2,
    ".ttf": 87,
    ".txt": 39,
    ".unity": 4,
    ".wav": 575,
    ".xml": 314,
    "<no-extension>": 15
  },
  "audio": {
    "busCount": 5,
    "busPaths": [
      "bus:/",
      "bus:/AMB",
      "bus:/SFX",
      "bus:/Music",
      "bus:/Subjective"
    ],
    "eventCount": 31,
    "eventPaths": [
      "event:/Ambience/HumBed",
      "event:/Ambience/AirBed",
      "event:/Ambience/Fixture",
      "event:/Ambience/FixtureEvent",
      "event:/Mechanism/Door/Handle",
      "event:/Mechanism/Door/Unlatch",
      "event:/Mechanism/Door/Swing",
      "event:/Mechanism/Door/StopLimit",
      "event:/Mechanism/Door/StopMid",
      "event:/Mechanism/Door/LatchStrike",
      "event:/Mechanism/Door/Locked",
      "event:/Mechanism/Door/Blow",
      "event:/Mechanism/Door/Break",
      "event:/Mechanism/Door/AutoOperator",
      "event:/Mechanism/Door/StreamOpen",
      "event:/Mechanism/Door/StreamClose",
      "event:/Mechanism/Door/StreamLock",
      "event:/Mechanism/Window/Stress",
      "event:/Mechanism/Window/Crack",
      "event:/Mechanism/Window/Shatter",
      "event:/Foley/Player/Footstep",
      "event:/Foley/Player/Cloth",
      "event:/Foley/Player/KeyPickup",
      "event:/Relay/Footstep",
      "event:/Relay/Presence",
      "event:/Relay/Clicks",
      "event:/Relay/Stinger",
      "event:/Subjective/Breath",
      "event:/Subjective/Heartbeat",
      "event:/Subjective/Tinnitus",
      "event:/Music/Title"
    ],
    "parameterCount": 19,
    "parameters": [
      {
        "identifier": "Tension",
        "value": "Tension"
      },
      {
        "identifier": "Zone",
        "value": "Zone"
      },
      {
        "identifier": "Tier",
        "value": "Tier"
      },
      {
        "identifier": "Openness",
        "value": "Openness"
      },
      {
        "identifier": "AngularVelocity",
        "value": "AngularVelocity"
      },
      {
        "identifier": "Impact",
        "value": "Impact"
      },
      {
        "identifier": "Damage",
        "value": "Damage"
      },
      {
        "identifier": "Progress",
        "value": "Progress"
      },
      {
        "identifier": "Level",
        "value": "Level"
      },
      {
        "identifier": "Stamina",
        "value": "Stamina"
      },
      {
        "identifier": "Proximity",
        "value": "Proximity"
      },
      {
        "identifier": "Occlusion",
        "value": "Occlusion"
      },
      {
        "identifier": "Dampness",
        "value": "Dampness"
      },
      {
        "identifier": "Surface",
        "value": "Surface"
      },
      {
        "identifier": "Gait",
        "value": "Gait"
      },
      {
        "identifier": "RelayGait",
        "value": "RelayGait"
      },
      {
        "identifier": "RelayState",
        "value": "RelayState"
      },
      {
        "identifier": "FixtureEvent",
        "value": "FixtureEvent"
      },
      {
        "identifier": "Leaf",
        "value": "Leaf"
      }
    ],
    "source": "Assets/Scripts/Audio/FrontRoomsSoundIds.cs"
  },
  "buildScenes": [
    "Assets/Scenes/FrontRooms3D.unity"
  ],
  "constants": {
    "ceilingMeters": {
      "Low": 2.4,
      "Standard": 2.9,
      "Tall": 5.4
    },
    "cellSizeMeters": 3.0,
    "chunkCells": 8,
    "chunkSizeMeters": 24.0,
    "worldRebaseThresholdMeters": 192.0
  },
  "levelProfile": {
    "dressing": {
      "dressOffices": 1,
      "pileChance": 0.35
    },
    "generation": {
      "borderOpening": 0.15,
      "lowArch": 0.2,
      "lowDoorway": 0.25,
      "lowPillar": 0,
      "lowRoomMax": 3,
      "lowRoomMin": 2,
      "lowRooms": 2,
      "lowShare": 0.35,
      "lowWall": 0.5,
      "officeShare": 0.3,
      "seed": 20261001,
      "standardArch": 0.1,
      "standardDoorway": 0.3,
      "standardPillar": 0,
      "standardRoomMax": 4,
      "standardRoomMin": 2,
      "standardRooms": 2,
      "standardShare": 0.55,
      "standardWall": 0.82,
      "tallArch": 0.1,
      "tallDoorway": 0.1,
      "tallPillar": 0.06,
      "tallRoomMax": 7,
      "tallRoomMin": 5,
      "tallRooms": 1,
      "tallShare": 0.1,
      "tallWall": 0.3
    },
    "lighting": {
      "lightRadius": 16,
      "shadowRadius": 9
    },
    "modules": [
      "32070142b44184661aad9494a5a35be4",
      "4632b3f0205194fed9874dac6dbe573a",
      "7970eac7f87914162937d8767042418e",
      "9d904919031224c88a8ee73f76e98147",
      "ebabc4fdf51ef462aa8d50937adf6519"
    ],
    "name": "FrontRoomsLevel0",
    "run": {
      "buildRadius": 2,
      "chunksPerFrame": 1,
      "doorsNeedKeys": 0,
      "runSeed": 0,
      "shiftAfterSeconds": 30
    },
    "source": "Assets/Levels/FrontRoomsLevel0.asset"
  },
  "modules": [
    {
      "customColumns": [],
      "data": {
        "allowRotate": 1,
        "columns": 1,
        "columnsName": "None",
        "customColumns": [],
        "depth": 3,
        "east": "000000",
        "eastValues": [
          0,
          0,
          0,
          0,
          0,
          0
        ],
        "fill": 0,
        "fillName": "None",
        "height": 1,
        "heightName": "Standard",
        "innerEast": "010100010102010100",
        "innerEastValues": [
          0,
          1,
          0,
          1,
          0,
          0,
          0,
          1,
          0,
          1,
          0,
          2,
          0,
          1,
          0,
          1,
          0,
          0
        ],
        "innerNorth": "0101010101010101",
        "innerNorthValues": [
          0,
          1,
          0,
          1,
          0,
          1,
          0,
          1,
          0,
          1,
          0,
          1,
          0,
          1,
          0,
          1
        ],
        "lamps": "000000000004000000000003",
        "lampsValues": [
          0,
          0,
          0,
          0,
          0,
          0,
          0,
          0,
          0,
          0,
          0,
          4,
          0,
          0,
          0,
          0,
          0,
          0,
          0,
          0,
          0,
          0,
          0,
          3
        ],
        "markers": null,
        "maxTier": 4,
        "minTier": 0,
        "north": "00000100",
        "northValues": [
          0,
          0,
          0,
          0,
          0,
          1,
          0,
          0
        ],
        "props": null,
        "south": "00020000",
        "southValues": [
          0,
          0,
          0,
          2,
          0,
          0,
          0,
          0
        ],
        "theme": 0,
        "themeName": "Level0",
        "weight": 1,
        "west": "000200",
        "westValues": [
          0,
          0,
          0,
          2,
          0,
          0
        ],
        "width": 4
      },
      "markers": [
        {
          "host": null,
          "kind": 0,
          "kindName": "KeySpot",
          "tag": null,
          "x": 3.2,
          "y": 0.66,
          "yaw": 20,
          "z": 8.66
        }
      ],
      "name": "L0_WaitingRoom_4x3",
      "notes": "Level 0: a waiting room cut in two by a partition with a doorway. Chairs face nobody. The key lies on the side table.",
      "props": [
        {
          "kit": "Kit_LadderChair",
          "noCollider": 0,
          "x": 1.2,
          "y": 0,
          "yaw": 180,
          "z": 8.603696
        },
        {
          "kit": "Kit_LadderChair",
          "noCollider": 0,
          "x": 1.8,
          "y": 0,
          "yaw": 180,
          "z": 8.603696
        },
        {
          "kit": "Kit_LadderChair",
          "noCollider": 0,
          "x": 2.4,
          "y": 0,
          "yaw": 180,
          "z": 8.603696
        },
        {
          "kit": "Kit_SideTableTurned",
          "noCollider": 0,
          "x": 3.2,
          "y": 0,
          "yaw": 180,
          "z": 8.66
        },
        {
          "kit": "Kit_WallClock",
          "noCollider": 0,
          "x": 4.5,
          "y": 2.1,
          "yaw": 180,
          "z": 8.89
        },
        {
          "kit": "Kit_Torchiere",
          "noCollider": 0,
          "x": 0.291,
          "y": 0,
          "yaw": 90,
          "z": 6.6
        },
        {
          "host": null,
          "kind": 0,
          "tag": null,
          "x": 3.2,
          "y": 0.66,
          "yaw": 20,
          "z": 8.66
        }
      ],
      "source": "Assets/Levels/Modules/L0_WaitingRoom_4x3.asset"
    },
    {
      "customColumns": [],
      "data": {
        "allowRotate": 1,
        "columns": 1,
        "columnsName": "None",
        "customColumns": [],
        "depth": 3,
        "east": "000000",
        "eastValues": [
          0,
          0,
          0,
          0,
          0,
          0
        ],
        "fill": 0,
        "fillName": "None",
        "height": 0,
        "heightName": "Low",
        "innerEast": "010101",
        "innerEastValues": [
          0,
          1,
          0,
          1,
          0,
          1
        ],
        "innerNorth": "01010101",
        "innerNorthValues": [
          0,
          1,
          0,
          1,
          0,
          1,
          0,
          1
        ],
        "lamps": "050000060300",
        "lampsValues": [
          0,
          5,
          0,
          0,
          0,
          0,
          0,
          6,
          0,
          3,
          0,
          0
        ],